japanese,chinese
子供の頃の夢と現在の自分について話してみましょう,聊聊童年的梦想和现在的自己
もし1日だけ超能力が使えるとしたら何をしますか？,如果有一天能使用超能力，你会做什么？
人生で最も影響を受けた本や映画について教えてください,请分享对你人生影响最大的书籍或电影
10年後の自分はどんな人になっていたいですか？,你希望10年后的自己变成什么样的人？
もし無人島に3つだけ持って行けるとしたら何を選びますか？,如果到无人岛只能带三样东西，你会选择什么？
今まで経験した中で最も勇気が必要だったことは何ですか？,到目前为止，你经历过的最需要勇气的事情是什么？
理想的な1日の過ごし方について話してみましょう,聊聊你理想中的一天是怎样度过的
もし時間を戻せるとしたら、どの瞬間に戻りたいですか？,如果能让时间倒流，你最想回到哪个时刻？
人生で最も大切にしている価値観は何ですか？,你人生中最重视的价值观是什么？
もし世界中どこでも住めるとしたら、どこに住みたいですか？,如果可以在世界任何地方居住，你想住在哪里？
今の自分にアドバイスをするとしたら何と言いますか？,如果要给现在的自己一个建议，你会说什么？
人生で最も感動した瞬間について教えてください,请分享你人生中最感动的时刻
もし魔法が使えるとしたら、世界をどう変えたいですか？,如果你会魔法，你想如何改变这个世界？
今までで最も困難だった挑戦とその結果について話してください,聊聊你遇到过的最困难的挑战和结果
もし1億円もらえるとしたら何に使いますか？,如果得到一亿日元，你会用来做什么？
人生で最も学んだことがある失敗経験について教えてください,请分享你从失败中学到最多的经历
理想の友人関係について話してみましょう,聊聊你理想中的友谊关系
もし今日が人生最後の日だとしたら何をしますか？,如果今天是人生的最后一天，你会做什么？
自分の性格で最も好きな部分と変えたい部分は何ですか？,你最喜欢自己性格的哪个部分？最想改变哪个部分？
人生で最も印象に残っている旅行について話してください,请分享你人生中印象最深刻的旅行经历
もし歴史上の人物と会えるとしたら誰に会いたいですか？,如果能见到历史人物，你最想见谁？
今の社会で最も解決したい問題は何ですか？,你认为当今社会最需要解决的问题是什么？
人生で最も誇りに思う瞬間について教えてください,请分享你人生中最引以为豪的时刻
もし動物と話せるとしたら、どの動物と何について話したいですか？,如果能和动物对话，你想和什么动物聊什么？
自分らしさとは何だと思いますか？,你认为什么是真正的自己？
好きなグッズについて話してみましょう,让我们谈谈我们最喜欢的商品
お薦めのレストランについて話してみましょう,我们来谈谈餐厅推荐吧。
もしドラえもんのポケットがあったら何をしたいですか？,如果你有哆啦A梦的口袋你会做什么？
好きな音楽について話してみましょう,让我们谈谈我们喜欢的音乐
座右の銘について話してみましょう,让我们谈谈座右铭
一番怖いと思うものについて話してみましょう,让我们来谈谈什么最令你害怕。
春節の習慣について話してみましょう,让我们谈谈中国新年的习俗
一番好きな食べ物は何ですか？なぜ好きですか？,您最喜欢的食物是什么？为什么？
みなさんが睡眠についてこだわりがあることを話してみましょう,让我们谈谈您的睡眠偏好。
翻訳の美しさを感じた文章を共有しましょう,分享一句你认为翻译得很美的句子
「AIと◯◯」について話してみましょう,让我们来谈谈“人工智能和____”
いつかしたいと思っているが、まだやっていないことについて話してみましょう,让我们来谈谈您希望将来某一天做但尚未做的事情。
故郷の名物や魅力について話してみましょう,我们来谈谈你家乡的特色和景点吧。
趣味や特技について話してみましょう,让我们谈谈我们的爱好和技能
みなさんが影響を受けた人物について話してみましょう,让我们谈谈对您有影响的人。
最近感動したエピソードや出来事は何ですか？,最近有什么故事或事件令你感动？
これまでに体験した中で一番冒険的なことは何ですか？,您曾经做过的最冒险的事情是什么？
夢について話してみましょう,让我们谈谈梦想
最近見た印象的なアート作品や展示は何ですか？,您最近看到的最难忘的艺术品或展览是什么？
これまでに経験した中で、最も誇りに思うことは何ですか？,您最引以为豪的经历是什么？
自分自身を動物に例えると何だと思いますか？その理由は？,如果将自己比作一种动物，您会选择什么？为什么？
生まれ変わったら、どんな世界に生まれたいですか？（自分にとって理想の世界を語りましょう）,如果你可以重生，你希望出生在什么样的世界？（谈谈你理想中的世界。）
みなさんにとって、「愛」のかたちはどんなものですか？ 家族愛、恋人愛、友人愛―さまざまな「愛」について話してみましょう,“爱”对你来说意味着什么？我们来聊聊“爱”的不同类型——亲情之爱、爱情之爱、友情之爱
哲学と科学、どちらがより真理に近いと思いますか？,您认为哪个更接近真理：哲学还是科学？
これだけは譲れないと思うこだわりは何ですか？,您最看重且不能妥协的事情是什么？
これだけは誰にも負けないと思うことは何ですか?,您认为自己能比别人做得更好的一件事是什么？
これまでに訪れた場所で一番印象に残っているところはどこですか？,到目前为止，您参观过的最难忘的地方是哪里？
暇なとき、どうやって時間を潰しますか？,当你有空闲时间时你如何消磨时间？
外見の重要性についてどう思いますか？ これまでに外見のためにどんな努力をしたことがありますか？もし自分の身体の一部を変えることができるとしたら、どこを変えたいですか？,外表有多重要？你为了改善自己的外表做了哪些努力？如果你可以改变身体的某个部位，你会选择改变哪个部位？
旅行の思い出について話してみましょう,聊聊我们的旅行记忆
もしタイムマシンがあったら、どの時代に行きたいですか？その理由は？,如果您有一台时间机器，您想去哪个时代？为什么？
もし一日だけ別の職業を体験できるとしたら、何を選びますか？,如果您可以在一天内尝试不同的工作，您会选择哪一份？
もし宝くじで大金を当てたら、何をしますか？,如果您中了彩票，您会做什么？
一番癒やされるものについて話してみましょう,让我们来谈谈最令人舒缓的事情。
外見の重要性について話してみましょう,让我们谈谈外表的重要性
関税紛争について話してみましょう,我们来谈谈关税争端。
言語学習中の面白いエピソードについて話してみましょう,分享一个关于你的语言学习的有趣故事
今まで読んだ小説もしくは漫画の中で、「え？何でここで突然カタカナを使うの？」と感じた経験がありますか？（今まで最も理解不能だったカタカナをシェアしましょう）,你有没有在读小说或漫画的时候突然想到：“啊？他们为什么突然在这里使用片假名？”（分享你读过的最难懂的片假名）
最近学んだ言語の表現や単語について話してみましょう,谈论你最近学到的语言表达方式或单词
最近最も驚いたニュースについて話してみましょう,我们来谈谈最近最令人吃惊的新闻。
最近出会った忘れられない人や出来事について話してみましょう,谈谈你最近遇到的一个难忘的人或事
最近乗り越えた課題や挑戦について共有しましょう,分享你最近克服的一个挑战
自分自身にモチベーションを湧き起こす方法について話してみましょう,让我们来谈谈如何激励自己。
数年前の自分に伝えたいことはありますか？,有什么话想对几年前的自己说吗？
子どもの日の思い出について話してみましょう,来说说童年的记忆吧。
MBTIについて話してみましょう,让我们谈谈 MBTI
みなさんにとって「童心」とは何ですか？今もその心を持っていますか？,“童真”对你来说意味着什么？你还保留着那种童真吗？
みなさんにとっての「幸せ」とは何ですか？,“幸福”对你来说意味着什么？
おすすめのアプリについて話してみましょう,让我们来谈谈一些我们最喜欢的应用程序
おすすめのストレス解消法について話してみましょう,让我们来讨论一些缓解压力的好方法。
デートの場所を決めるなら、どこを選びますか？そこで相手が何をすればあなたの好感度が最も上がりますか？逆に、相手が何をすれば好感度が下がりますか？,如果让你决定约会地点，你会选哪里？你的约会对象会在那里做什么让你最喜欢他们？反过来，什么会让你最不喜欢他们？
もし無人島に一つだけ持っていけるとしたら、何を選びますか？その理由は？,如果您只能带一件东西去荒岛，您会选择什么？为什么？
おすすめの健康管理法やリラックス方法について話してみましょう,让我们谈谈推荐的健康和放松方法
おすすめの効果的な勉強方法について話してみましょう,让我们谈谈一些有效的学习方法
最近「これを初めて体験した！」という出来事はありますか？,最近是否有过这样的经历让你觉得“我以前从来没有经历过这样的事情！？”
最近の小さな幸せは何ですか？,最近有什么小事给你带来快乐？
最近ハマっていることは何ですか？,最近你在忙些什么？
最近関心を持ったニュースや出来事について話しましょう,让我们谈谈最近引起你关注的新闻和事件
最近見た印象深い夢はどんな夢でしたか？,您最近做过的最难忘的梦是什么？
最近知った面白い雑学や豆知識について話してみましょう,分享一些你最近了解到的有趣的琐事或事实
最近発見した便利なアプリやサービスについて話してみましょう,告诉我们您最近发现的一个有用的应用程序或服务。
人生で大切にしている価値観や信念について話してみましょう,谈谈你在生活中珍视的价值观和信仰。
みなさんが卒業したことや、卒業したいことは何ですか？,你毕业了什么？或者你想毕业什么？
「大切にしている習慣」や「毎日欠かせないこと」は何ですか？ 健康、趣味、学習、家族との時間など、ご自身のエピソードとともに話してみましょう,你的“重要习惯”和“日常生活中必不可少的事物”是什么？请讲述你的健康、爱好、学习、与家人相处的时间等，并分享你自己的故事。
人間として生きている日々の中で、「人生よ、今回だけは勘弁してくれよ....」と思わされた瞬間はありますか？,在日常生活中，你是否有时会想，“亲爱的生活，就这一次，请给我一个机会……”
大企業のネジ山（ボタンネジ）と中小企業の大動脈、どちらを選びますか？,您会选择哪一个：大公司的线程（按钮螺丝）还是中小型企业的动脉？
好きな異性のしぐさは何ですか？,您最喜欢异性的什么手势？
許せるマナー違反、絶対許さないマナー違反について話してみましょう,让我们来谈谈哪些礼仪违规行为是可以接受的，哪些是绝对不能容忍的。
学生、会社人、どっちがいいですか？,你愿意当一名学生还是一名公司职员？
どんな旅行のスタイルが好きですか？,您最喜欢哪种旅行方式？
これだけは食べられないと思うものは何ですか？,您不能吃的东西是什么？
いつも背中を押してくれる人は誰ですか？,谁是一直支持你的人？
世代間のギャップについて話してみましょう,让我们来谈谈代沟。
五年後自分は何をしていると思いますか？,您认为自己五年后会做什么？
落ち込んでいる人を励ます方法について話してみましょう,让我们来谈谈如何鼓励情绪低落的人。
嘘の良い面・悪い面について話してみましょう,让我们来谈谈说谎的好处和坏处。
人生で「今が一番幸せだ！」と思った瞬間は、どんな時ですか？,你人生中最幸福的时刻是什么时候？
今まで、何かで夜に全然眠れなかったことはありますか？,你有没有经历过彻夜不眠的事情？
なぜこの街で暮らすことにしたのですか？また、将来どこで暮らしてみたいですか？,,你为什么选择在这个城市生活？将来你想住在哪里？
自分の人生で一番大切な人は誰ですか？,你生命中最重要的人是谁？
自分の人生で一番大切な出来事は何ですか？,你生命中最重要的事件是什么？
自分の人生で一番大切な経験は何ですか？,你生命中最重要的经历是什么？
自分の人生で一番大切な教訓は何ですか？,你生命中最重要的教训是什么？
自分の人生で一番大切な価値観は何ですか？,你生命中最重要的价值观是什么？
自分の人生で一番大切な目標は何ですか？,你生命中最重要的目标是什么？
自分の人生で一番大切な夢は何ですか？,你生命中最重要的梦想是什么？
自分の人生で一番大切な人間関係は何ですか？,你生命中最重要的人际关系是什么？
みんなの旅行の思い出について話してみましょう,请告诉我们大家的旅行经历。
自分が「好きなこと」を追い求めるのは正しいと思いますか？そのためにどんな努力や犠牲を払ったことがありますか？,你认为追求自己喜欢的事情是对的吗？为了这个目标你做过哪些努力或牺牲？
災害や盗難、詐欺から身を守るための方法について話してみましょう,让我们来谈谈如何保护自己免受灾害、盗窃和欺诈的影响。
もしみなさんがガイドをするとしたら、どのように広州や自分の故郷で案内しますか？,如果你是导游，你会如何在广州或你的家乡带领游客？
「七タ」の思い出や計画、地域の風習について話してみましょう,让我们来谈谈“七夕”的记忆、计划和当地习俗。
平行世界の自分はどんな感じだと思いますか？もし会えたら、何を話しますか？,你认为平行世界中的自己是什么样的？如果你能见到他/她，你会和他/她谈些什么？
みなさんの環境では「次を決めずに退職」はどの程度受け入れられていますか。また、長所と短所はなんですか？,在你的环境中，“辞职而不找下一份工作”被接受的程度如何？它的优点和缺点是什么？
みなさんは裸辞の経験がありますか。ない場合、するとしたら何が不安ですか。,你有过裸辞的经历吗？如果没有，你会担心什么？
退職後はどう過ごしましたか(または、どう過ごしたいですか)。生活費·時間の使い方·心と体のケアは？また、周囲の反応(家族·友人·職場)はどうでしたか。どのように説明·説得しましたか。,你是如何度过退休生活的（或者你想如何度过退休生活）？生活费用、时间管理、身心护理等方面是怎样的？此外，周围人的反应（家人、朋友、工作场所）如何？你是如何解释和说服他们的？
みなさんの身近な場所が観光地になった際のメリット・デメリットは何ですか？,当你身边的地方变成旅游景点时，有哪些优点和缺点？
オーバーツーリズム対策の4軸:規制·分散·価格·マナー啓発。優先順位と理由は何ですか？,在应对过度旅游的四个方面：监管、分散、价格和礼仪宣传中，你会如何排序它们的优先级？请说明理由。
オーバーツーリズムに関して、住民と観光のバランスを取るために、できる対策は何ですか？また、効果検証の指標設計(騒音、ゴミ、満足度、再訪率など)は何ですか？,关于过度旅游，为了在居民和游客之间取得平衡，可以采取哪些措施？此外，效果评估的指标设计（如噪音、垃圾、满意度、回访率等）是什么？
「地域密着型商業」と「観光化商業」や、オーパーツーリズムにおける社会的弱者の公共空間使用権について話してみましょう,让我们来谈谈“社区本地化商业”和“旅游商业”，以及过度旅游中社会弱势群体的公共空间使用权。
SNSにおいて、みなさんのフィードに偏りはありますか。またその要因は何だと思いますか？(履歴·滞在時間·交友関係など),在社交媒体上，你的信息流是否存在偏见？你认为造成这种偏见的原因是什么？（如浏览历史、停留时间、社交关系等）
効率(好みに合う)と多様性(異質情報)のトレードオフをどう設計したらよいか話してみましょう,让我们来谈谈如何设计效率（符合个人偏好）和多样性（异质信息）之间的权衡。
個人・プラットフォーム・公共部門それぞれの打ち手を列挙し、優先順位を決めてみましょう。また、透明性と説明可能性はどこまで必要ですか。副作用はありますか？,列举个人、平台和公共部门的应对措施，并确定优先级。此外，透明度和可解释性需要达到什么程度？是否存在副作用？
もしこの先1年間、同じ食べ物しか選べないとしたら、何にしますか？理由も教えてください。,如果在接下来的一年里你只能选择同一种食物，你会选择什么？请告诉我们原因。
旅行後に、期待と現実のギャップで「魅力が薄れた」と感じた街·観光地はありますか？,在旅行后，你是否觉得某个城市或旅游景点因为期望与现实的差距而“失去了魅力”？
星座·血液型·干支などが性格に影響すると信じますか。性格は「生まれつき」と「後天的な情報·環境」のどちらの影響が大きいと思いますか？,你相信星座、血型、生肖等会影响性格吗？你认为性格更多地受到“先天因素”还是“后天信息和环境”的影响？
みなさんが3歳ぐらいの時の記憶や記録について話してみましょう,让我们来谈谈你大约三岁时的记忆和记录。
「縁」について話してみましょう,让我们来谈谈“缘分”。
国慶節の連休の過ごし方と、これまでの思い出について話してみましょう,让我们来谈谈国庆节长假的度过方式和过去的回忆。
「孤独」について、感じ方と向き合い方などを話してみましょう,让我们来谈谈“孤独”，包括你的感受和应对方式。
みなさんの性別が入れ替わったとしたら、自分を好きになれると思いますか？,如果你的性别发生了变化，你认为你会喜欢自己吗？
最近始めた、またはやめた習慣は何ですか。また、そのきっかけは何ですか？,你最近开始或停止了哪些习惯？是什么促使你这样做的？
三日坊主を防ぐために、どんな工夫をしていますか。1分でできる小さな行動を、具体的に一つ教えてください,你是如何防止三天打鱼两天晒网的？请具体告诉我们一个你能在一分钟内完成的小行动。
朝型と夜型で、合うルーティンはどのように違いますか？,早晨型和夜晚型的人适合什么样的日常作息？
会社や学校から30分で行けるご褒美スポットを教えて下さい。また、混雑回避の方法やおすすめの時間帯、席の選び方、持って行くと捗るアイテムを教えてください,请告诉我们一个你可以在30分钟内从公司或学校到达的奖励地点。此外，请告诉我们如何避免拥挤、推荐的时间段、座位选择以及携带哪些物品会更方便。
旅の荷物のミニマム化について話してみましょう。絶対入れるものと現地調達するもの、またその理由は何ですか？また、失敗談はありますか？,让我们来谈谈如何最小化旅行行李。你会带哪些必需品，哪些会在当地购买？请告诉我们原因。此外，你有没有失败的经历？
今までで一番怖かった体験はなんですか？,你经历过的最可怕的事情是什么？
みなさんが好きなホラー作品について話してみましょう,让我们来谈谈你喜欢的恐怖作品。
身近な都市伝説について話してみましょう。また、信じたくなる理由はありますか？,让我们来谈谈你身边的都市传说。此外，你有没有什么理由想要相信它们？
一人でやったことのあることの中で、一番孤独だったことは何ですか？また、その時の気持ちはどうでしたか？,你一个人做过的事情中，最孤独的是什么？当时你的感受如何？
日本の「謝罪文化」についてどう思いますか？少しのミスでも謝罪することについて、良い点と悪い点を教えてください,你如何看待日本的“道歉文化”？请告诉我们即使是小错误也要道歉的优点和缺点。
「大学生になったら自由」「大人になったら自由」は本当ですか？よくそのように言われますが、実際は逆だと感じたことはありませんか？,“成为大学生后就自由了”“成为大人后就自由了”是真的吗？人们常这么说，但你有没有觉得实际上情况正好相反？
食べ物の組み合わせで、「これはちょっと理解できないな」と思うものはありますか？逆に、「これは最高の組み合わせだ！」と思うものはありますか？,你有没有觉得某些食物的组合“有点难以理解”？相反，你有没有觉得“这是最棒的组合！”？
各国や都市の鉄道・列車乗ったことはありますか？また、印象に残っている違いや体験は何ですか？,你乘坐过哪些国家或城市的铁路和列车？有哪些印象深刻的差异或经历？
「優しい嘘(善意の嘘)」をついたことがありますか？また、「優しい嘘(善意の嘘)」は本当に存在すると思いますか？,你有没有说过“善意的谎言”？你认为“善意的谎言”真的存在吗？
みなさんの好きな歌詞の一節を教えてください,请告诉我们你最喜欢的歌词片段。
電子レンジで温めるだけや、ご飯にかけるだけですぐに食べられるような、調理が簡単で疲れた日におかずの一品になるおすすめの食品はありますか？,你有没有推荐的食物，既可以用微波炉加热，也可以直接倒在米饭上，既简单又能在疲惫的日子里成为一道菜？
冷凍食品なのに、「まるでレストラン並み！」と驚くような味のものはありますか？購入先もあわせて教えてください,你有没有吃过冷冻食品，味道让你惊讶地觉得“简直就像餐厅做的一样！”？请告诉我们购买地点。
少ない費用で大きな効果を得る「お得な経験」はありますか？みなさんに共有したい「隠れたお得情報」があれば、教えてください,你有没有过以较少的费用获得巨大效果的“划算体验”？如果你有想与大家分享的“隐藏的划算信息”，请告诉我们。
みなさんがハマっているYouTube・bilibiliのチャンネルやポッドキャストについて話してみましょう,让我们来谈谈你喜欢的 YouTube、bilibili 频道或播客。
冬の思い出について話してみましょう,让我们来谈谈冬天的回忆。
今までで一番良いと思った自分へのご褒美は何ですか？,你认为自己收到过的最好的奖励是什么？
みなさんの座右の銘を教えてください。その言葉に出会ったきっかけと、選んだ理由は何ですか？,请告诉我们你的座右铭。是什么让你遇到了这句话？你选择它的原因是什么？
